<?xml version="1.0" encoding="UTF-8"?>
<!DOCTYPE toolbar:toolbar PUBLIC "-//OpenOffice.org//DTD OfficeDocument 1.0//EN" "toolbar.dtd">
<toolbar:toolbar xmlns:toolbar="http://openoffice.org/2001/toolbar" xmlns:xlink="http://www.w3.org/1999/xlink">
 <toolbar:toolbaritem xlink:href=".uno:SaveAs" toolbar:helpid="5502"/>
 <toolbar:toolbaritem xlink:href=".uno:ExportDirectToPDF" toolbar:helpid="6674"/>
 <toolbar:toolbarseparator/>
 <toolbar:toolbaritem xlink:href=".uno:EditDoc" toolbar:visible="false" toolbar:helpid="helpid:6312"/>
 <toolbar:toolbaritem xlink:href=".uno:SendMail" toolbar:helpid="helpid:5331"/>
 <toolbar:toolbarseparator/>
 <toolbar:toolbaritem xlink:href=".uno:PrintDefault" toolbar:helpid="helpid:5509"/>
 <toolbar:toolbarseparator/>
 <toolbar:toolbaritem xlink:href=".uno:Copy" toolbar:helpid="helpid:5711"/>
 <toolbar:toolbarseparator/>
 <toolbar:toolbaritem xlink:href=".uno:SearchDialog" toolbar:helpid="helpid:5961"/>
 <toolbar:toolbaritem xlink:href=".uno:Navigator" toolbar:helpid="helpid:10366"/>
 <toolbar:toolbarseparator/>
 <toolbar:toolbaritem xlink:href=".uno:Zoom" toolbar:helpid="helpid:10000"/>
</toolbar:toolbar>